hypothesis_id,description,motivation,status,comment
h001,PPO baseline (envpool),Establish PPO performance baseline on 15-game Atari subset,closed,"CORRECTED 3-SEED BASELINES: Alien=200, Amidar=2.2, BattleZone=2150, Breakout=1.4, DoubleDunk=-17.9, MsPacman=319, NameThisGame=2348, Phoenix=796, PrivateEye=-135, Qbert=158, Solaris=2280, SpaceInvaders=147. Zero: Enduro/MontezumaRevenge/Venture."
h002,PQN baseline (envpool),Establish PQN performance baseline on 15-game Atari subset,closed,"CORRECTED BASELINES: Alien=179, Amidar=31.6, BattleZone=3411, Breakout=1.8, DoubleDunk=-24, MsPacman=249, NameThisGame=1437, Phoenix=86.5, PrivateEye=-241, Qbert=151, Solaris=504, SpaceInvaders=287. Zero: Enduro/MontezumaRevenge/Venture."
h003,PPO + LayerNorm,Add LayerNorm to PPO NatureCNN — known plasticity intervention from CHAIN-SP paper,closed,3-seed complete: 1W/1L/13T (net 0). Only Amidar win (free). Neutral. Closed.
h004,PQN + NaP (weight projection),"Add Normalize-and-Project to PQN — complement existing LayerNorm, top plasticity method from Plasticine",promising,"3-seed NEAR-COMPLETE (11/15 at 3 seeds): 2W/0L/13T (net +2). WINS: MsPacman +23%, PrivateEye +28%. Very safe technique, no losses. 11 running."
h005,PPO + LayerNorm + CHAIN-SP,Full CHAIN-SP approach: LayerNorm + churn reduction loss for PPO,promising,"3-seed eval in progress: 1W/1L/13T (net 0). WIN: PrivateEye. LOSS: MsPacman -21%. 2/15 complete at 3 seeds. 28 running."
h006,PPO + Symlog value transform,DreamerV3-style symlog/symexp on value targets for scale-invariant learning,closed,2W/2L/11T — Neutral. Closed.
h007,PPO + Soft Shrink-and-Perturb,Post-update weight shrinkage + noise for plasticity maintenance (proven in on-policy RL),promising,"3-seed eval: 3W/2L/10T (net +1). WINS: BattleZone +21%, PrivateEye, Solaris +78%. LOSSES: Breakout, MsPacman -22%. 7/15 complete at 3 seeds. 11 running."
h008,PQN + LSTM,"Add LSTM to PQN for memory-dependent games (Montezuma, Venture, etc.)",promising,"POLARIZED: 7W/5L/3T (net +2). Huge Phoenix +465%, PrivateEye +377%, Solaris +181% wins. But Amidar -28%, BattleZone -14%, SpaceInvaders -31% losses. 3-seed eval in progress (30 gaps, 30 running)."
h009,PPO + RND exploration,Random Network Distillation intrinsic motivation for hard exploration games,closed,2W/3L/10T (net -1). Closed.
h010,PPO + IMPALA CNN,Replace NatureCNN with IMPALA ResNet encoder — stronger visual processing with residual connections,promising,3/15 at 40M (old format). Still waiting — 9 running.
h011,PQN + IMPALA CNN,Replace NatureCNN with IMPALA ResNet encoder for PQN baseline,promising,3/15 at 40M (old format). Still waiting — 9 running.
h012,PPO + Data Augmentation (DrQ-style),DrQ-style random shift augmentation — improves representation quality,promising,"3-seed eval: 3W/1L/11T (net +2). WINS: Amidar, BattleZone +13%, PrivateEye +473%. LOSS: MsPacman -19%. 0/15 complete at 3 seeds. 23 running."
h013,PPO + Spectral Normalization,"Spectral norm on CNN layers constrains Lipschitz constant, prevents rank collapse",promising,"3-seed eval: 3W/1L/11T (net +2). WINS: Amidar, PrivateEye, Qbert +18%. LOSS: MsPacman -18%. 1/15 complete at 3 seeds. 25 running."
h014,PPO + Entropy Annealing,"Anneal entropy coef from 0.03 to 0.001 — high early exploration, low late exploitation",closed,2W/2L/11T. Neutral. Closed.
h015,PPO + PopArt value normalization,Adaptive value function normalization for scale-invariant learning across games,closed,1W/2L/12T. Solaris loss. Closed.
h016,PPO + Network Sparsity,"Random pruning 50% weights at init, static mask throughout training — ICML 2025 oral",closed,"2W/2L/11T. BattleZone +35%, PrivateEye +113%. Losses: MsPacman/Solaris. Neutral."
h017,PPO + SPO (TV divergence),"Replace PPO clipping with soft TV divergence penalty — ICLR 2025, simpler trust region",closed,"3W/2L/10T. Phoenix +14%, Qbert +15%. Losses: MsPacman -19%, PrivateEye -39%."
h018,PPO + Schedule-Free AdamW,"Schedule-Free optimizer eliminates LR annealing, maintains optimal implicit schedule — NeurIPS 2024",closed,4W/7L/4T (net -3). Very poor. Closed.
h019,PPO + Muon Optimizer,Muon uses Newton-Schulz orthogonalization on gradients for matrix-shaped params,proposed,"11/15 pilot: ~neutral. 8 running. Will close when complete."
h020,PPO + Dueling Value/Advantage Architecture,Separate value and advantage streams for better value estimation — adapted for actor-critic,closed,Old-format data. High variance. Closed.
h021,PPO + Spectral Normalization + DrQ Augmentation,Combine h013 (SpectralNorm) and h012 (DrQ aug),proposed,"3/15 pilot (old format). Breakout=0 (catastrophic), Qbert=125 (-21%). CONCERNING. 11 running."
h022,PPO + Quantile Regression Value Function,Replace scalar V(s) with N-quantile distributional value head,proposed,1/15 (old format). Too early. 11 running.
h023,PPO + Spectral Normalization + Shrink-and-Perturb,Combine SpectralNorm (h013) with S&P (h007) — dual plasticity mechanism,proposed,"2/15 pilot (old format). Qbert=225 (+42%!). VERY PROMISING early signal. 11 running."
h024,PPO + Proximal Feature Optimization (PFO),NeurIPS 2024 — constrain feature drift via L2 loss on pre-activation changes,proposed,1/15 (old format). Too early. 12 running.
h025,PPO + Dual Value Head (ClippedDoubleV),"Two V-heads, min(V1,V2) for conservative advantage. TD3 double-Q trick for PPO.",proposed,"40M resubmission in progress (9 at 10M old data, 11 running at 40M). 3 early 40M old-format results: Breakout=9.0, Amidar=31.0, Qbert=150.0. Pending proper q4_return."
h026,PQN + NaP + LSTM,"Combine LSTM (h008) + NaP (h004). NaP excludes LSTM params to preserve gates.",proposed,"40M resubmission in progress. 3 old-format results (Amidar/Breakout/Qbert). 7 submitted. Waiting."
