hypothesis_id,description,motivation,status,comment
h001,PPO baseline (envpool),Establish PPO performance baseline on 15-game Atari subset,closed,"COMPLETE 45/45. Avg Q4=550. Wins 7/15 games vs PQN. Dominates: Phoenix (9x), Solaris (5.7x), NameThisGame (1.7x), MsPacman, DoubleDunk, Alien, PrivateEye. Fails: Enduro(0), MontezumaRevenge(0), Venture(0). Low: Breakout(1.4), Amidar(2.2)."
h002,PQN baseline (envpool),Establish PQN performance baseline on 15-game Atari subset,closed,"COMPLETE 45/45. Avg Q4=391. Wins 4/15 games vs PPO. Dominates: Amidar (14.5x), BattleZone (1.5x), SpaceInvaders (1.9x), Breakout (1.3x). Fails: Enduro(0), MontezumaRevenge(0), Venture(0). Low: DoubleDunk(-24), Phoenix(87)."
h003,PPO + LayerNorm,Add LayerNorm to PPO NatureCNN — known plasticity intervention from CHAIN-SP paper,closed,"COMPLETE 45/45 at 40M 3-seed. CATASTROPHIC: 3W/7L/5T. Phoenix 0.27x, Qbert 0.31x, Solaris 0.32x, SpaceInvaders 0.36x, PrivateEye 4.77x worse. Seed 1 results misleading — seeds 2/3 show collapse to 0 on many games. LayerNorm causes severe late-training instability."
h004,PQN + NaP (weight projection),"Add Normalize-and-Project to PQN — complement existing LayerNorm, top plasticity method from Plasticine",promising,"10M pilot 15/15: BEST sample efficiency (12/15 >= 40M base at 10M). 40M 3-seed eval RUNNING. Pilot: 3W/3L/9T vs PQN base."
h005,PPO + LayerNorm + CHAIN-SP,Full CHAIN-SP approach: LayerNorm + churn reduction loss for PPO,promising,"10M pilot 15/15: highest avg Q4(10M)=515. 40M 3-seed eval RUNNING. May share h003's late-training instability — WATCH CLOSELY."
h006,PPO + Symlog value transform,DreamerV3-style symlog/symexp on value targets for scale-invariant learning,closed,"COMPLETE 15/15 at 40M. 2W/1L/12T — NEUTRAL. Only MsPacman loss. No benefit over PPO baseline. Closed."
h007,PPO + Soft Shrink-and-Perturb,Post-update weight shrinkage + noise for plasticity maintenance (proven in on-policy RL),promising,"PILOT 14/15 (missing Enduro=always 0). 5W/1L/8T — BEST W/L RATIO. Solaris +78% (4054!), PrivateEye sign reversal, BattleZone +16%, Amidar 14x, Breakout 3x. Only MsPacman -17%. 3-seed eval RUNNING."
h008,PQN + LSTM,"Add LSTM to PQN for memory-dependent games (Montezuma, Venture, etc.)",proposed,"5/15 at 40M. 2W/0L/3T vs PQN. Phoenix 5.6x(!), Breakout 2.2x. Amidar/Qbert/Venture ties. 10 games still running."
h009,PPO + RND exploration,Random Network Distillation intrinsic motivation for hard exploration games,proposed,"12/15 at 40M. 3W/2L/7T. Wins: Amidar 14x, Breakout 2.2x, PrivateEye sign reversal. Losses: NameThisGame -27%, Phoenix -18%. Missing: Enduro, Solaris, Venture."
h010,PPO + IMPALA CNN,Replace NatureCNN with IMPALA ResNet encoder — stronger visual processing with residual connections,proposed,"3/15 at 40M (Amidar=31, Breakout=5, Qbert=150). Too early. 12 games still running."
h011,PQN + IMPALA CNN,Replace NatureCNN with IMPALA ResNet encoder for PQN baseline,proposed,"3/15 at 40M. Breakout 3.3x win but Amidar 0.03x LOSS. Too early. 12 games still running."
h012,PPO + Data Augmentation (DrQ-style),DrQ-style random shift augmentation — improves representation quality,promising,"COMPLETE 15/15 PILOT. 3W/2L/10T. PrivateEye Q4=502 (BEST EVER!), BattleZone +33%, Amidar 14x. Losses: Breakout 0, MsPacman -19%. READY FOR 3-SEED EVAL."
h013,PPO + Spectral Normalization,"Spectral norm on CNN layers constrains Lipschitz constant, prevents rank collapse",promising,"COMPLETE 15/15 PILOT. 5W/1L/9T — EXCELLENT. Solaris +34%, Phoenix +19%, Breakout 3.7x, PrivateEye sign reversal, Amidar +41%. Only Qbert loss (0.79x). READY FOR 3-SEED EVAL."
h014,PPO + Entropy Annealing,"Anneal entropy coef from 0.03 to 0.001 — high early exploration, low late exploitation",promising,"12/15 at 40M. 3W/1L/8T. Amidar 14x, Breakout 3x, PrivateEye improved, Solaris tie. MsPacman -24% loss. Missing: DoubleDunk, Enduro, SpaceInvaders."
h015,PPO + PopArt value normalization,Adaptive value function normalization for scale-invariant learning across games,proposed,"11/15 at 40M. 1W/1L/9T — SAFE but minimal. Only Breakout win, MsPacman loss. No dramatic gains. Missing: Alien, BattleZone, NameThisGame, PrivateEye."
h016,PPO + Network Sparsity,"Random pruning 50% weights at init, static mask throughout training — ICML 2025 oral",promising,"10/15 at 40M. 4W/0L/6T — ZERO LOSSES! BattleZone +35%, PrivateEye improved, Amidar 14x, Breakout 2.2x. Missing: DoubleDunk, MsPacman, NameThisGame, Phoenix, Solaris (KEY games)."
h017,PPO + SPO (TV divergence),"Replace PPO clipping with soft TV divergence penalty — ICLR 2025, simpler trust region",proposed,"9/15 at 40M. 2W/1L/6T. Breakout 3.7x, Amidar 14x wins. PrivateEye LOSS (worse than PPO). Phoenix neutral. Missing 6 key games."
h018,PPO + Schedule-Free AdamW,"Schedule-Free optimizer eliminates LR annealing, maintains optimal implicit schedule — NeurIPS 2024",closed,"COMPLETE 15/15 pilot. 3W/9L/3T — BAD. Phoenix 0.02x, Solaris 0x, BattleZone -53%. Schedule-Free destroys PPO training dynamics."
h019,PPO + Muon Optimizer,"Muon uses Newton-Schulz orthogonalization on gradients for matrix-shaped params",proposed,"3/15 at 40M. Amidar 14x, Breakout 3x wins. Too early — 12 games still running."
h020,PPO + Dueling Value/Advantage Architecture,Separate value and advantage streams for better value estimation — adapted for actor-critic,closed,"COMPLETE 15/15 pilot. 5W/4L/6T — HIGH VARIANCE. BattleZone 3.7x, Amidar 15x, SpaceInvaders 1.9x wins. But Phoenix 0.08x, Solaris 0.15x, DoubleDunk/MsPacman losses. Too unstable."
